question,answer
"what is the function of the INY instruction in 6502 assembly language?","The INY instruction increments the Index Y register by one, which is a 8-bit register used to store memory addresses or counters. This instruction is essential in various programming scenarios, such as looping, array indexing, and memory manipulation."
"what is the addressing mode of the INY instruction?","The addressing mode of the INY instruction is implied, which means that the instruction operates on the Index Y register directly, without the need to specify a memory address or operand."
"what is the opcode of the INY instruction?","The opcode of the INY instruction is C8, which is a single-byte opcode that represents the instruction in the machine language."
"how many bytes does the INY instruction occupy in memory?","The INY instruction occupies only 1 byte in memory, making it a compact and efficient instruction."
"how many cycles does the INY instruction take to execute?","The INY instruction takes 2 cycles to execute, which is relatively fast compared to other instructions that may take more cycles to complete."
"what is the purpose of the Index Y register in 6502 assembly language?","The Index Y register is an 8-bit register used to store memory addresses or counters, and is essential for various programming tasks, such as looping, array indexing, and memory manipulation."
"can the INY instruction be used for looping?","Yes, the INY instruction can be used for looping by incrementing the Index Y register, which can be used as a counter to control the loop iterations."
"how can the INY instruction be used for memory manipulation?","The INY instruction can be used for memory manipulation by incrementing the Index Y register, which can be used as a pointer to access memory locations, allowing for efficient data manipulation and processing."
"what is the difference between the INY and INX instructions?","The INY instruction increments the Index Y register, while the INX instruction increments the Index X register, which are both 8-bit registers used for different purposes in 6502 assembly language."
"can the INY instruction be used with other instructions to perform complex tasks?","Yes, the INY instruction can be used with other instructions, such as load and store instructions, to perform complex tasks, such as data processing, array manipulation, and memory management."