question,answer
"What is the main difference between the 6566 and 6567 video interface chips?","The main difference between the 6566 and 6567 video interface chips lies in their address output configurations. The 6566 has thirteen fully decoded addresses for direct connection to the system address bus, whereas the 6567 has multiplexed addresses for direct connection to 64K dynamic RAMS."
"How do the 6566 and 6567 video interface chips differ in their address output configurations?","The 6566 has fully decoded addresses for direct connection to the system address bus, whereas the 6567 has multiplexed addresses for direct connection to 64K dynamic RAMS, with the least significant address bits, A06-A00, present on A06-A00 while /RAS is brought low, and the most significant bits, A13-A08, present on A05-A00 while /CAS is brought low."
"What is the purpose of pins A11-A07 on the 6567 video interface chip?","The pins A11-A07 on the 6567 video interface chip are static address outputs, allowing direct connection of these bits to a conventional 16K (2K*8) ROM."
"How does the 6567 video interface chip handle the lower order addresses?","The lower order addresses on the 6567 video interface chip require external latching."
"What is the significance of the /RAS signal in the 6567 video interface chip?","The /RAS signal is used to bring the least significant address bits, A06-A00, low, allowing them to be present on A06-A00."
"What is the significance of the /CAS signal in the 6567 video interface chip?","The /CAS signal is used to bring the most significant address bits, A13-A08, low, allowing them to be present on A05-A00."
"How does the 6567 video interface chip connect to a 64K dynamic RAM?","The 6567 video interface chip connects to a 64K dynamic RAM through its multiplexed addresses, with the least significant address bits, A06-A00, present on A06-A00 while /RAS is brought low, and the most significant bits, A13-A08, present on A05-A00 while /CAS is brought low."
"What is the advantage of using the 6567 video interface chip with a 64K dynamic RAM?","The advantage of using the 6567 video interface chip with a 64K dynamic RAM is that it allows for direct connection and efficient memory access, making it well-suited for applications that require large memory capacities."
"How does the 6566 video interface chip differ from the 6567 in terms of address decoding?","The 6566 video interface chip has fully decoded addresses, whereas the 6567 has multiplexed addresses, which affects how they connect to memory and other components."
"What is the significance of the address bus in the context of the 6566 and 6567 video interface chips?","The address bus is significant in the context of the 6566 and 6567 video interface chips because it determines how they connect to memory and other components, with the 6566 having fully decoded addresses and the 6567 having multiplexed addresses."