question,answer
"what are the three components of a voice in the 6581 synthesizer?","A voice in the 6581 synthesizer consists of three components: a Tone Oscillator/Waveform Generator, an Envelope Generator, and an Amplitude Modulator."
"how does the tone oscillator control the pitch of a voice?","The Tone Oscillator controls the pitch of a voice over a wide range, producing four waveforms at the selected frequency, with the unique harmonic content of each waveform providing simple control of tone color."
"what is the function of the amplitude modulator in a voice?","The Amplitude Modulator controls the volume dynamics of the oscillator under the direction of the Envelope Generator, allowing for programmable rates of increasing and decreasing volume."
"what is the purpose of the envelope generator in a voice?","The Envelope Generator creates an amplitude envelope with programmable rates of increasing and decreasing volume when triggered, allowing for dynamic control of the voice's volume."
"how can the third oscillator be used in addition to generating sound?","The third oscillator can be used as a random number generator for games, and its output can be read by the microprocessor to create vibrato, frequency/filter sweeps, and similar effects."
"what is the purpose of the two A/D converters in the SID chip?","The two A/D converters are provided for interfacing SID with potentiometers, allowing for the use of 'paddles' in a game environment or as front panel controls in a music synthesizer."
"how can multiple SID chips be used together?","Multiple SID chips can be daisy-chained or mixed in complex polyphonic systems, allowing for the processing of external audio signals and the creation of complex sounds."
"what is the function of the programmable filter in the SID chip?","The programmable Filter is provided for generating complex, dynamic tone colors via subtractive synthesis, allowing for a wide range of tonal possibilities."
"how can the SID chip be used in conjunction with external audio sources?","The SID chip can process external audio signals, allowing for the integration of external audio sources into the sound generation process."
"what is the advantage of using the SID chip in a music synthesizer?","The SID chip provides a powerful and flexible sound generation system, allowing for the creation of complex and dynamic sounds through the use of its three voices, programmable filter, and external audio processing capabilities."