question,answer
"Can the OSC 3 register be used as a random number generator?","Yes, it can be used as a random number generator for games."
"What is the range of numbers generated by the OSC 3 register when the Sawtooth waveform is selected?","The range is from 0 to 255 ($FF)."
"What happens to the output of the OSC 3 register when the Triangle waveform is selected?","The output will increment from 0 up to 255, then decrement down to 0."
"What is the purpose of the OSC 3 register in modulation?","The purpose is to generate modulation for various audio effects."
"What is the effect of adding the OSC 3 Sawtooth output to the frequency control of another oscillator?","It can create siren-like sounds."
"What is the effect of adding the OSC 3 Noise output to the Filter Frequency control registers?","It can produce synthesizer "Sample and Hold" effects."
"What is the effect of adding the OSC 3 Triangle output to the Frequency control of another oscillator?","It can produce vibrato."
"What is the range of effects available by altering the frequency of Oscillator 3 and scaling the OSC 3 output?","The range is unlimited."
"What happens to the audio output of Voice 3 when Oscillator 3 is used for modulation?","The audio output should be eliminated (3 OFF = 1)."