question,answer
"what is the main function of the C64 operating system","The main function of the C64 operating system is to organize the memory in the machine for various tasks, it also handles the input from the keyboard and displays it on the screen, and performs many other functions, essentially acting as the 'intelligence and personality' of the Commodore 64."
"what happens when you turn on your Commodore 64","When you turn on your Commodore 64, the operating system takes control of your machine, performs its initial setup and configuration, and after completing its 'housework', it displays the READY. prompt, indicating that it is ready to accept commands and interact with the user."
"what is the significance of the READY. prompt","The READY. prompt is a message displayed by the C64 operating system after it has completed its initialization and setup, indicating that it is ready to accept commands and interact with the user, allowing the user to start using the computer."
"what is the role of the operating system in a computer","The operating system plays a crucial role in a computer, acting as the 'intelligence and personality' of the machine, it manages the computer's resources, handles input and output, and provides a platform for running applications and interacting with the user."
"how does the operating system handle user input","The operating system handles user input by reading the characters typed on the keyboard and displaying them on the screen, allowing the user to interact with the computer and issue commands."
"what is the relationship between the operating system and the computer","The operating system is the 'brain' of the computer, it is the software that controls and manages the computer's hardware, providing a platform for running applications and interacting with the user, and is essential for the computer to function."
"what is the purpose of the operating system's 'housework'","The operating system's 'housework' refers to the initial setup and configuration that it performs when the computer is turned on, this includes initializing the hardware, loading the operating system, and preparing the computer for use."
"what is the significance of the operating system in the Commodore 64","The operating system is the core of the Commodore 64, it provides the foundation for the computer's functionality, and is responsible for managing the computer's resources, handling input and output, and providing a platform for running applications and interacting with the user."
"how does the operating system manage the computer's resources","The operating system manages the computer's resources by allocating memory, managing I/O operations, and controlling access to the computer's hardware, ensuring that the computer's resources are used efficiently and effectively."
"what is the role of the operating system in managing the computer's hardware","The operating system plays a crucial role in managing the computer's hardware, it provides a layer of abstraction between the hardware and the user, allowing the user to interact with the computer without needing to know the details of the hardware."