question,answer
"what is the purpose of the PEEK and POKE commands in CBM BASIC language?","The PEEK and POKE commands in CBM BASIC language are used for changing memory locations, commonly used for graphics on the screen and for sound effects. They allow the programmer to access and modify specific memory locations by specifying their addresses."
"in the context of the Commodore 64, what is an address?","In the context of the Commodore 64, an address refers to a unique number that identifies a specific memory location. It's like a street address, where each memory location has its own number, allowing the programmer to access and manipulate it."
"what is the analogy used to describe memory locations in the Commodore 64?","The analogy used to describe memory locations in the Commodore 64 is a street of buildings, where each building represents a memory location, and the number on each door is the address of that location."
"what is the purpose of specifying an address when using PEEK and POKE commands?","The purpose of specifying an address when using PEEK and POKE commands is to identify the specific memory location that the programmer wants to access or modify, allowing for precise control over the computer's memory."
"what is the relationship between memory locations and addresses in the Commodore 64?","In the Commodore 64, each memory location has its own unique address, which serves as an identifier for that location. This allows the programmer to access and manipulate specific memory locations using their addresses."
"how do PEEK and POKE commands interact with memory locations in the Commodore 64?","PEEK and POKE commands interact with memory locations in the Commodore 64 by allowing the programmer to read from or write to specific memory locations, using their addresses to access and modify their contents."
"what is the significance of memory addresses in programming the Commodore 64?","Memory addresses are significant in programming the Commodore 64 because they provide a way to access and manipulate specific memory locations, allowing the programmer to control the computer's behavior and perform specific tasks."
"in what way do PEEK and POKE commands provide control over memory locations?","PEEK and POKE commands provide control over memory locations by allowing the programmer to read from or write to specific memory locations, giving them precise control over the computer's memory and enabling them to perform specific tasks."
"what is the role of addresses in the context of PEEK and POKE commands?","In the context of PEEK and POKE commands, addresses play the role of identifiers for specific memory locations, allowing the programmer to target and manipulate specific locations in the computer's memory."
"how do addresses enable the programmer to access specific memory locations?","Addresses enable the programmer to access specific memory locations by providing a unique identifier for each location, allowing the programmer to use PEEK and POKE commands to read from or write to specific locations in the computer's memory."