question,answer
"what is the significance of the Y index register in machine language instructions?","The Y index register is a crucial register in machine language instructions, allowing for a range of transformations and operations that are unique to this register, including copying contents from and to memory locations, modifying its own contents, and interacting with other registers."
"what types of instructions are available for the Y register?","The Y register has a range of instructions available, including those that allow copying the contents of a memory location into the Y register, copying the contents of the Y register into a memory location, and modifying the contents of the Y register or other registers directly."
"can the accumulator be used for all transformations?","No, while there are instructions for nearly all transformations that can be made to the accumulator and the X register, there are specific instructions that are unique to the Y register, highlighting its importance in machine language programming."
"what is the relationship between the Y register and memory locations?","The Y register has a close relationship with memory locations, allowing for the copying of contents from memory locations into the Y register and vice versa, making it a crucial component in data manipulation and storage."
"how does the Y register interact with other registers?","The Y register can interact with other registers, including the accumulator and the X register, allowing for a range of operations and transformations to be performed, including modifications to the contents of these registers."
"what is the purpose of the Y register in machine language programming?","The purpose of the Y register is to provide a range of unique transformations and operations that are not available to the accumulator and X register, making it an essential component in machine language programming."
"can the Y register be used for general-purpose computations?","While the Y register is primarily used for specific transformations and operations, it can also be used for general-purpose computations, making it a versatile and valuable component in machine language programming."
"how does the Y register differ from the X register?","The Y register differs from the X register in the range of instructions available, with the Y register having unique instructions that are not available to the X register, making it a distinct and important component in machine language programming."
"is the Y register used in conjunction with other registers?","Yes, the Y register is often used in conjunction with other registers, including the accumulator and X register, to perform a range of operations and transformations, highlighting its importance in machine language programming."
"what is the significance of the Y register in data manipulation?","The Y register plays a crucial role in data manipulation, allowing for the copying of contents from and to memory locations, and modifying the contents of the Y register or other registers directly, making it an essential component in machine language programming."