question,answer
"what is the high resolution screen of the Commodore 64 and why is it not explained in the User Manual","The high resolution screen of the Commodore 64 is a facility that allows for detailed graphics and is not fully explained in the User Manual because it is aimed at a basic level and the high resolution screen is not an easy facility to learn to use."
"where is the high resolution screen located on the Commodore 64","The high resolution screen is a facility that is built into the Commodore 64 and can be accessed through programming, its location is not a physical one but rather a virtual one that can be tapped into using the right programming techniques."
"what is the purpose of the high resolution screen on the Commodore 64","The purpose of the high resolution screen on the Commodore 64 is to allow for detailed graphics and to provide a higher level of graphical capability than the standard text mode, it can be used to create detailed images and graphics."
"what kind of programming is required to use the high resolution screen on the Commodore 64","To use the high resolution screen on the Commodore 64, a programmer needs to have a good understanding of machine language programming and be able to write code that can access and manipulate the high resolution screen, this includes using subroutines and programming techniques that are specific to the Commodore 64."
"what kind of graphics can be created using the high resolution screen on the Commodore 64","The high resolution screen on the Commodore 64 allows for the creation of detailed and complex graphics, including images, charts, and diagrams, it can also be used to create animations and other graphical effects."
"can the high resolution screen on the Commodore 64 be used for game development","Yes, the high resolution screen on the Commodore 64 can be used for game development, it provides a higher level of graphical capability than the standard text mode and can be used to create detailed and complex graphics, making it ideal for game development."
"what is the difference between the high resolution screen and the standard text mode on the Commodore 64","The high resolution screen on the Commodore 64 provides a higher level of graphical capability than the standard text mode, it allows for detailed and complex graphics, whereas the standard text mode is limited to text characters and simple graphics."
"how does the high resolution screen on the Commodore 64 compare to other computers of the time","The high resolution screen on the Commodore 64 was one of the most advanced graphical capabilities of its time, it provided a level of detail and complexity that was unmatched by other computers of the time, making it a popular choice for graphics and game development."
"is the high resolution screen on the Commodore 64 difficult to use","Yes, the high resolution screen on the Commodore 64 can be difficult to use, it requires a good understanding of machine language programming and specific programming techniques, it is not a facility that can be easily learned and requires a lot of practice and patience."
"what kind of subroutines can be used to drive the high resolution screen on the Commodore 64","There are many subroutines that can be used to drive the high resolution screen on the Commodore 64, including subroutines for drawing lines, circles, and other shapes, as well as subroutines for manipulating colors and graphics, these subroutines can be used to create complex and detailed graphics."