question,answer
"what is the significance of poking to the screen on a c64","when poking to the screen on a c64, it is essential to remember to poke the appropriate character colour into the colour memory, as the basic print statement does this automatically for you, ensuring that the correct colours are displayed on the screen"
"what is the role of the basic print statement when printing to the screen on a c64","the basic print statement, when used to print to the screen on a c64, automatically pokes the appropriate character colour into the colour memory, eliminating the need for manual intervention"
"what happens when you poke to the screen on a c64 without setting the character colour","when poking to the screen on a c64 without setting the character colour, the resulting display may be incorrect or distorted, as the colour memory has not been properly updated, highlighting the importance of setting the correct character colour"
"what is the purpose of the colour memory when poking to the screen on a c64","the colour memory plays a crucial role when poking to the screen on a c64, as it stores the colour information for each character, and must be updated accordingly to ensure correct display"
"how does the basic print statement simplify the process of printing to the screen on a c64","the basic print statement simplifies the process of printing to the screen on a c64 by automatically handling the task of poking the appropriate character colour into the colour memory, freeing the programmer from this responsibility"
"what is the relationship between poking to the screen and the colour memory on a c64","there is a direct relationship between poking to the screen and the colour memory on a c64, as poking to the screen requires updating the colour memory with the correct colour information for each character"
"why is it important to update the colour memory when poking to the screen on a c64","it is essential to update the colour memory when poking to the screen on a c64, as failure to do so can result in incorrect or distorted display, highlighting the importance of proper colour memory management"
"what is the role of the programmer when poking to the screen on a c64","the programmer plays a crucial role when poking to the screen on a c64, as they must ensure that the correct character colour is poked into the colour memory, a task that is automated by the basic print statement"
"what are the consequences of not updating the colour memory when poking to the screen on a c64","not updating the colour memory when poking to the screen on a c64 can result in incorrect or distorted display, emphasizing the importance of proper colour memory management in c64 programming"
"how does the c64 handle colour information when poking to the screen","the c64 handles colour information when poking to the screen by storing it in the colour memory, which must be updated accordingly to ensure correct display, a task that can be automated by the basic print statement"