question,answer
"what is the purpose of the POKE command in the given code snippet?","The POKE command is used to store a value in a specific memory location, in this case, to put a character at a specific X,Y location on the screen, with a specific color."
"what is the significance of the number 1 in the code snippet?","The number 1 represents the character code for the character 'A' that is being placed at the specified X,Y location on the screen."
"what is the role of the multiplication operation in the code snippet?","The multiplication operation is used to calculate the memory location where the character will be stored, based on the X and Y coordinates, with the formula being P0KEY*4CH-X+1 and Y*40fX+5."
"what is the purpose of the number 5296 in the code snippet?","The number 5296 is the starting address of the screen memory in the Commodore 64, where the character will be stored."
"what is the significance of the number 2 in the code snippet?","The number 2 represents the color code for the color red, which is the color in which the character 'A' will be displayed at the specified X,Y location."
"what is the purpose of the comma in the POKE command?","The comma in the POKE command is used to separate the memory address from the value being stored at that address."
"what is the significance of the starting address of the screen memory?","The starting address of the screen memory, 5296, is the base address where the characters are stored, and the X and Y coordinates are used to offset from this address to store the character at the correct location."
