question,answer
"what is the purpose of the volume control knob on the 1702 monitor?","the volume control knob on the 1702 monitor is used to adjust the sound volume, with turning it to the right increasing the volume and turning it to the left decreasing the volume."
"how do you increase the sound volume on the 1702 monitor?","to increase the sound volume on the 1702 monitor, you need to turn the volume control knob to the right, which will allow you to amplify the sound to your desired level."
"what happens when you turn the volume control knob to the left on the 1702 monitor?","when you turn the volume control knob to the left on the 1702 monitor, the sound volume decreases, allowing you to reduce the noise level to a more comfortable setting."
"what is the function of the volume control knob on the 1702 monitor?","the function of the volume control knob on the 1702 monitor is to regulate the sound volume, providing users with the ability to customize the audio output to their preferences."
"how do you decrease the sound volume on the 1702 monitor?","to decrease the sound volume on the 1702 monitor, you need to turn the volume control knob to the left, which will reduce the noise level and provide a more subtle audio experience."
"what is the relationship between the volume control knob and the sound volume on the 1702 monitor?","the volume control knob on the 1702 monitor is directly linked to the sound volume, with clockwise rotations increasing the volume and counterclockwise rotations decreasing the volume."
"what is the purpose of adjusting the volume control knob on the 1702 monitor?","the purpose of adjusting the volume control knob on the 1702 monitor is to customize the sound volume to individual preferences, ensuring a comfortable and enjoyable audio experience."
"in what direction do you turn the volume control knob to increase the sound volume on the 1702 monitor?","to increase the sound volume on the 1702 monitor, you need to turn the volume control knob to the right, which will amplify the sound and provide a louder audio output."
"in what direction do you turn the volume control knob to decrease the sound volume on the 1702 monitor?","to decrease the sound volume on the 1702 monitor, you need to turn the volume control knob to the left, which will reduce the noise level and provide a softer audio output."
"what is the effect of turning the volume control knob to the right on the 1702 monitor?","turning the volume control knob to the right on the 1702 monitor increases the sound volume, allowing users to amplify the audio output to their desired level."