question,answer
"what is the primary concern of the safety precautions in the 1702 monitor","The primary concern of the safety precautions in the 1702 monitor is to prevent potential electrical shock or fire hazards that can result from improper use, and to ensure the personal safety of the user by observing basic rules for its installation, use, and servicing, as well as following all warnings and instructions marked on the video monitor."
"what is the purpose of the safeguards incorporated in the 1702 monitor","The purpose of the safeguards incorporated in the 1702 monitor is to assure the personal safety of the user, and to prevent potential electrical shock or fire hazards that can result from improper use, by providing a safe and reliable operation of the monitor."
"what should be observed during the installation of the 1702 monitor","During the installation of the 1702 monitor, the basic rules for its installation, use, and servicing should be observed, and all warnings and instructions marked on the video monitor should be followed, in order to prevent potential electrical shock or fire hazards and ensure personal safety."
"what is the importance of following warnings and instructions marked on the video monitor","Following warnings and instructions marked on the video monitor is important because it helps to prevent potential electrical shock or fire hazards, and ensures the personal safety of the user, by providing critical information on the safe and proper use of the monitor."
"what is the result of improper use of the 1702 monitor","The result of improper use of the 1702 monitor can be potential electrical shock or fire hazards, which can be prevented by observing the basic rules for its installation, use, and servicing, and following all warnings and instructions marked on the video monitor."
"what is the purpose of the electrical energy in the 1702 monitor","The purpose of the electrical energy in the 1702 monitor is to perform many useful functions, but it requires proper use and handling to prevent potential electrical shock or fire hazards and ensure personal safety."
"what is the role of the user in ensuring safety in the 1702 monitor","The role of the user in ensuring safety in the 1702 monitor is to observe the basic rules for its installation, use, and servicing, and to follow all warnings and instructions marked on the video monitor, in order to prevent potential electrical shock or fire hazards and ensure personal safety."
"what is the benefit of engineered and manufactured safeguards in the 1702 monitor","The benefit of engineered and manufactured safeguards in the 1702 monitor is that they provide an additional layer of protection against potential electrical shock or fire hazards, and help to ensure the personal safety of the user."
"what is the relationship between improper use and safety hazards in the 1702 monitor","There is a direct relationship between improper use and safety hazards in the 1702 monitor, as improper use can result in potential electrical shock or fire hazards, which can be prevented by observing the basic rules for its installation, use, and servicing, and following all warnings and instructions marked on the video monitor."
"what is the importance of servicing the 1702 monitor properly","Servicing the 1702 monitor properly is important because it helps to prevent potential electrical shock or fire hazards, and ensures the personal safety of the user, by maintaining the monitor in a safe and reliable operating condition."