question,answer
"what is the purpose of the tint control knob on the 1702 monitor?","The tint control knob on the 1702 monitor is used to adjust the color settings, specifically to add more red or green to the display. Turning the knob to the left adds more red, while turning it to the right adds more green. The normal setting for this knob is at the center, which is the click-stop position, providing a balanced color display."
"how should you approach adjusting the color settings on the 1702 monitor?","When adjusting the color settings on the 1702 monitor, it's recommended to focus on one or two specific colors at a time, such as brown and purple, to achieve the desired color balance. This approach helps to ensure that the colors are accurately adjusted and the display is visually appealing."
"what is the default position of the tint control knob on the 1702 monitor?","The default position of the tint control knob on the 1702 monitor is at the center, which is the click-stop position. This setting provides a balanced color display and is the recommended starting point for adjusting the color settings."
"what happens when you turn the tint control knob to the left on the 1702 monitor?","When you turn the tint control knob to the left on the 1702 monitor, you add more red to the display. This adjustment can be useful for correcting color imbalances or achieving a specific color tone."
"what happens when you turn the tint control knob to the right on the 1702 monitor?","When you turn the tint control knob to the right on the 1702 monitor, you add more green to the display. This adjustment can be useful for correcting color imbalances or achieving a specific color tone."
"why is it important to focus on one or two colors when adjusting the tint control knob on the 1702 monitor?","Focusing on one or two colors at a time when adjusting the tint control knob on the 1702 monitor helps to ensure that the colors are accurately adjusted and the display is visually appealing. This approach prevents over-correction and ensures that the colors are balanced and natural-looking."
"what is the effect of adjusting the tint control knob on the overall color display of the 1702 monitor?","Adjusting the tint control knob on the 1702 monitor affects the overall color display by adding more red or green to the display. This adjustment can enhance or correct the color balance, resulting in a more visually appealing display."
"what is the recommended approach to adjusting the tint control knob on the 1702 monitor?","The recommended approach to adjusting the tint control knob on the 1702 monitor is to start at the center click-stop position and make small adjustments to the left or right to achieve the desired color balance."
"how does the tint control knob on the 1702 monitor affect the display of brown and purple colors?","The tint control knob on the 1702 monitor affects the display of brown and purple colors by allowing you to adjust the color balance to achieve a more accurate representation of these colors. By adjusting the tint control knob, you can add more red or green to the display to correct any color imbalances."
"what is the purpose of the click-stop position on the tint control knob of the 1702 monitor?","The click-stop position on the tint control knob of the 1702 monitor serves as a reference point for the default color setting. It provides a balanced color display and serves as a starting point for making adjustments to the color settings."