question,answer
"What is the purpose of the CONTRAST CONTROL knob on a 1702 monitor?","The CONTRAST CONTROL knob on a 1702 monitor is used to adjust the contrast of the display, with turning it to the right increasing the contrast and the normal setting being at the center position."
"What happens when you turn the CONTRAST CONTROL knob to the right on a 1702 monitor?","When you turn the CONTRAST CONTROL knob to the right on a 1702 monitor, the contrast of the display increases, allowing for a clearer and more defined image."
"What is the normal setting for the CONTRAST CONTROL knob on a 1702 monitor?","The normal setting for the CONTRAST CONTROL knob on a 1702 monitor is at the center position, providing an optimal balance of contrast for the display."
"How does the CONTRAST CONTROL knob affect the display on a 1702 monitor?","The CONTRAST CONTROL knob on a 1702 monitor affects the display by adjusting the contrast, which can improve the overall clarity and visibility of the image."
"What is the effect of increasing the contrast on a 1702 monitor?","Increasing the contrast on a 1702 monitor can improve the visibility of details in the image, making it clearer and more defined."
"What is the purpose of adjusting the CONTRAST CONTROL knob on a 1702 monitor?","The purpose of adjusting the CONTRAST CONTROL knob on a 1702 monitor is to optimize the display for the best possible image quality, taking into account the specific needs of the user."
"How does the CONTRAST CONTROL knob interact with other display settings on a 1702 monitor?","The CONTRAST CONTROL knob on a 1702 monitor interacts with other display settings, such as brightness and color, to provide a comprehensive range of adjustments for optimal image quality."
"What are the benefits of adjusting the CONTRAST CONTROL knob on a 1702 monitor?","Adjusting the CONTRAST CONTROL knob on a 1702 monitor can improve the overall image quality, enhance visibility, and provide a more comfortable viewing experience."
"What is the relationship between the CONTRAST CONTROL knob and image quality on a 1702 monitor?","The CONTRAST CONTROL knob on a 1702 monitor has a direct impact on image quality, as it adjusts the contrast to optimize the display for the best possible image."
"How does the CONTRAST CONTROL knob contribute to the overall display performance on a 1702 monitor?","The CONTRAST CONTROL knob on a 1702 monitor contributes to the overall display performance by providing a critical adjustment for optimizing the contrast, which is essential for a clear and detailed image."