question,answer
"what is the purpose of the POS function in Commodore 64 BASIC?","The POS function in Commodore 64 BASIC returns the number of the column (0-39) at which the next PRINT statement will begin on the screen, allowing the programmer to determine the current print position and plan their output accordingly."
"what is the range of values returned by the POS function?","The POS function returns a value between 0 and 39, indicating the column number on the screen where the next PRINT statement will begin."
"can the POS function be used with any value of X?","Yes, the POS function can be used with any value of X, as X is not actually used in the function and is essentially a placeholder."
"how does the POS function relate to the PRINT statement?","The POS function is closely tied to the PRINT statement, as it returns the column number where the next PRINT statement will begin, allowing the programmer to control the output of their program."
"what is the data type of the value returned by the POS function?","The POS function returns an integer value, specifically a column number between 0 and 39."
"in what way is the X parameter used in the POS function?","The X parameter is not actually used in the POS function, it is simply a placeholder and can be any value."
"can the POS function be used to set the print position?","No, the POS function only returns the current print position, it does not set the print position."
"what is the significance of the range 0-39 in the POS function?","The range 0-39 in the POS function corresponds to the 40-column screen of the Commodore 64, with 0 being the leftmost column and 39 being the rightmost column."
"how does the POS function interact with the screen layout?","The POS function interacts with the screen layout by returning the column number where the next PRINT statement will begin, allowing the programmer to control the output and layout of their program."
"can the POS function be used in conjunction with other BASIC statements?","Yes, the POS function can be used in conjunction with other BASIC statements, such as the PRINT statement, to control the output and layout of a program."