question,answer
"what is the purpose of the OPEN statement in Commodore 64?","The OPEN statement allows the Commodore 64 to access devices such as the cassette recorder, disk for data, a printer, or even the screen, enabling the computer to read or write data to these devices."
"what is the range of numbers that can be used with the OPEN statement?","The number that follows the OPEN statement can be any value between 0 and 255, and all following statements will refer to this number."
"what is the purpose of the second number in the OPEN statement?","The second number in the OPEN statement is the device number, which specifies the device to be accessed, such as the screen, cassette, printer, or disk, with device numbers being 0 for screen, 1 for cassette, 4 for printer, and 8 for disk."
"what is the purpose of the third number in the OPEN statement?","The third number in the OPEN statement, separated by a comma, is the secondary address, which has different meanings depending on the device, such as 0 for read, 1 for write, and 2 for write with end-of-tape marker for the cassette, and buffer or channel number for the disk."
"what does the following code snippet do: OPEN 1,0?","This code snippet opens the screen as a device, with the number 1 referring to the file or channel and 0 being the device number for the screen."
"what does the following code snippet do: OPEN 2,1,0,\"D\"?","This code snippet opens the cassette for reading, with the number 2 referring to the file or channel, 1 being the device number for the cassette, 0 being the secondary address for read, and \"D\" being the file to be searched for."
"what does the following code snippet do: OPEN 3,4?","This code snippet opens the printer, with the number 3 referring to the file or channel and 4 being the device number for the printer."
"what does the following code snippet do: OPEN 4,8,15?","This code snippet opens the data channel on the disk, with the number 4 referring to the file or channel, 8 being the device number for the disk, and 15 being the buffer or channel number."
"what is the relationship between the OPEN statement and the CLOSE statement?","The OPEN statement is used to open a device for access, and the CLOSE statement is used to close the device when access is no longer needed, with the CLOSE statement being used in conjunction with the OPEN statement to manage device access."
"where can more information about the OPEN statement be found?","More information about the OPEN statement can be found in the Commodore 64 Programmer's Reference Manual."