question,answer
"what does the RESTORE command do in a C64 program?","The RESTORE command resets the pointer to the first item in a DATA statement, allowing the program to re-read the information from the beginning, effectively restarting the data reading process."
"how do you use the RESTORE command in a C64 program?","The RESTORE command is used by placing it on a line by itself in the program, it does not require any arguments or parameters, and its purpose is to reset the data pointer to the beginning of the data list."
"what is the purpose of the RESTORE command in a C64 program?","The purpose of the RESTORE command is to reset the data pointer to the beginning of the data list, allowing the program to re-read the data from the start, which can be useful in various scenarios such as re-initializing the data or restarting a process."
"can you use the RESTORE command multiple times in a C64 program?","Yes, the RESTORE command can be used multiple times in a C64 program, and each time it is executed, it will reset the data pointer to the beginning of the data list, allowing the program to re-read the data from the start."
"what happens when the RESTORE command is executed in a C64 program?","When the RESTORE command is executed in a C64 program, the pointer to the next item in the DATA statement is reset to the first item in the list, allowing the program to re-read the information from the beginning."
"why would you use the RESTORE command in a C64 program?","You would use the RESTORE command in a C64 program when you need to re-read the data from the beginning, such as when you need to restart a process or re-initialize the data, and it is especially useful when working with large datasets or complex algorithms."
"can the RESTORE command be used with other commands in a C64 program?","Yes, the RESTORE command can be used in conjunction with other commands in a C64 program, such as READ and DATA, to create complex data processing and manipulation routines."
"what is the syntax for using the RESTORE command in a C64 program?","The syntax for using the RESTORE command in a C64 program is simply to place the command on a line by itself, with no arguments or parameters required, and it will reset the data pointer to the beginning of the data list."
"how does the RESTORE command interact with the DATA statement in a C64 program?","The RESTORE command interacts with the DATA statement by resetting the pointer to the first item in the list, allowing the program to re-read the information from the beginning, and it is especially useful when working with large datasets or complex algorithms."
"is the RESTORE command specific to the C64 or can it be used in other programming languages?","The RESTORE command is specific to the Commodore 64 (C64) programming language and is not a standard command in other programming languages, although similar functionality may be achieved through other means in other languages."