question,answer
"what is the purpose of the ATN function in C64 basic?","The ATN function in C64 Basic is used to calculate the angle, measured in radians, whose tangent is a given value X. This function is essential in trigonometric calculations and is often used in conjunction with other trigonometric functions like SIN and COS to solve complex mathematical problems."
"what is the unit of measurement for the angle returned by the ATN function?","The angle returned by the ATN function is measured in radians, which is a unit of angular measurement that is widely used in mathematics and computer science."
"what is the relationship between the ATN function and the tangent of an angle?","The ATN function returns the angle whose tangent is a given value X, which means that if you pass a value X to the ATN function, it will return the angle whose tangent is equal to X."
"can you use the ATN function to calculate the angle of a right triangle?","Yes, the ATN function can be used to calculate the angle of a right triangle, given the length of the opposite side and the adjacent side. This is a common application of the ATN function in trigonometry."
"what is the syntax for using the ATN function in C64 Basic?","The syntax for using the ATN function in C64 Basic is simply ATN(X), where X is the value whose tangent you want to calculate the angle for."
"how does the ATN function handle invalid input values?","The ATN function in C64 Basic will return an error if the input value is invalid, such as if the input value is not a number or is outside the valid range for the tangent function."
"can you use the ATN function to calculate the angle of a non-right triangle?","No, the ATN function is only suitable for calculating the angle of a right triangle, given the length of the opposite side and the adjacent side. For non-right triangles, you would need to use more advanced trigonometric functions or formulas."
"what is the relationship between the ATN function and the SIN and COS functions?","The ATN function is closely related to the SIN and COS functions, as they are all used to perform trigonometric calculations. In fact, the ATN function can be used in conjunction with the SIN and COS functions to solve complex trigonometric problems."
"is the ATN function available in all versions of C64 Basic?","Yes, the ATN function is a standard function in all versions of C64 Basic, and can be used in any program or script that requires trigonometric calculations."
"can you use the ATN function to calculate the angle of a circle?","No, the ATN function is not suitable for calculating the angle of a circle, as it is designed specifically for calculating the angle of a right triangle. For calculating the angle of a circle, you would need to use a different mathematical approach or function."