question,answer
"what is the purpose of the COS function in C64 BASIC?","The COS function in C64 BASIC returns the value of the cosine of an angle X, where X is measured in radians, providing a way to calculate trigonometric values in programming."
"what is the unit of measurement for the angle X in the COS function?","The angle X in the COS function is measured in radians, which is a fundamental unit of angular measurement in mathematics and computing."
"what is the return value of the COS function in C64 BASIC?","The COS function in C64 BASIC returns the value of the cosine of the input angle X, which is a decimal value between -1 and 1, representing the ratio of the adjacent side to the hypotenuse in a right-angled triangle."
"can the COS function be used with degrees instead of radians?","No, the COS function in C64 BASIC expects the input angle X to be in radians, not degrees, so if you want to use degrees, you would need to convert them to radians first using the formula: radians = degrees * π / 180."
"in what type of calculations is the COS function commonly used?","The COS function is commonly used in trigonometric calculations, such as solving triangular problems, calculating distances and angles in geometry, and modeling periodic phenomena in physics and engineering."
"how does the COS function relate to other trigonometric functions?","The COS function is closely related to other trigonometric functions, such as SIN and TAN, as they are all based on the ratios of sides in a right-angled triangle, and can be used together to solve complex trigonometric problems."
"what is the difference between COS and COSH in C64 BASIC?","The COS function in C64 BASIC calculates the cosine of an angle, whereas the COSH function calculates the hyperbolic cosine of a number, which is a different mathematical function with distinct properties and applications."
"can the COS function be used in graphical programming?","Yes, the COS function can be used in graphical programming to create circular and elliptical shapes, and to calculate positions and movements of objects in 2D and 3D spaces."
"how does the COS function handle invalid input values?","The COS function in C64 BASIC will return an error or an undefined value if the input angle X is invalid or out of range, so it's essential to validate and sanitize the input values before using the COS function."
"is the COS function available in all versions of C64 BASIC?","The COS function is a standard function in most versions of C64 BASIC, but it's always a good idea to check the documentation and specifications of your particular version to ensure its availability and behavior."