question,answer
"what is the purpose of the PEEK function in Commodore 64 programming?","The PEEK function is used to retrieve the contents of a specific memory location, allowing the programmer to examine the value stored at a particular address in the range of 0-65535, returning a result in the range of 0-255."
"What is the typical use case for the PEEK function?","The PEEK function is often used in conjunction with the POKE statement, allowing programmers to read and write values to specific memory locations, enabling them to manipulate and examine the contents of memory."
"What is the range of values that can be retrieved using the PEEK function?","The PEEK function can retrieve values in the range of 0-255, which corresponds to a single byte of memory."
"What is the range of memory addresses that can be accessed using the PEEK function?","The PEEK function can access memory locations in the range of 0-65535, which is the entire address space of the Commodore 64."
"How does the PEEK function interact with the POKE statement?","The PEEK function is often used in conjunction with the POKE statement, which allows programmers to write values to specific memory locations, and then use PEEK to retrieve and examine those values."
"What is the data type of the value returned by the PEEK function?","The PEEK function returns a byte-sized value, which is an unsigned 8-bit integer in the range of 0-255."
"What is the purpose of using PEEK in conjunction with POKE?","Using PEEK in conjunction with POKE allows programmers to read and write values to specific memory locations, enabling them to manipulate and examine the contents of memory, and perform tasks such as initializing variables, storing data, and debugging code."
"Can the PEEK function be used to access any memory location?","The PEEK function can access any memory location in the range of 0-65535, which is the entire address space of the Commodore 64, allowing programmers to examine and manipulate the contents of memory."
"How does the PEEK function retrieve values from memory?","The PEEK function retrieves values from memory by accessing the specified memory location and returning the contents of that location, which is a byte-sized value in the range of 0-255."
"What is the significance of the PEEK function in Commodore 64 programming?","The PEEK function is a fundamental part of Commodore 64 programming, allowing programmers to examine and manipulate the contents of memory, and is often used in conjunction with the POKE statement to perform a wide range of tasks."