question,answer
"what is the operation being performed in the given instruction","The operation being performed is a transfer of the accumulator to index X"
"what is the accumulator being transferred to","Index X"
"what is the instruction being performed on","The accumulator"
"what is the assembly language form of the instruction","TAX"
"what is the op code of the instruction","AA"
"how many bytes does the instruction occupy","1"
"how many cycles does the instruction take","2"
"what is the addressing mode of the instruction","Implied"
"what is the purpose of the instruction","To transfer the accumulator to index X"