question,answer
"What is the function of the ABS command in C64 Basic?","The ABS command in C64 Basic is a numeric function that returns the absolute value of a number. It takes one argument, which is the number for which you want to find the absolute value. For example, if you want to find the absolute value of -5, you would use the command ABS -5, which would return 5."
"What is the use of the AND command in C64 Basic?","The AND command in C64 Basic can be used as a logical operator to check the truth between two expressions. It returns a non-zero value if both expressions are true, and zero if either expression is false. It takes two arguments, which are the expressions you want to compare. For example, if you want to check if the variables A and B are both greater than 5, you would use the command IF A > 5 AND B > 5, which would return a non-zero value if both conditions are true."
"What is the purpose of the ASC command in C64 Basic?","The ASC command in C64 Basic is a numeric function that gives the ASCII value of the first character in a string. It takes one argument, which is the string for which you want to find the ASCII value of the first character. For example, if you want to find the ASCII value of the first character in the string "Hello", you would use the command ASC "Hello", which would return the value 72, which is the ASCII value of the character 'H'."
"What is the ATN command in C64 Basic used for?","The ATN command in C64 Basic is a mathematical function that returns the arctangent of a number in radians. It takes one argument, which is the number for which you want to find the arctangent. For example, if you want to find the arctangent of 1, you would use the command ATN 1, which would return 0.7853981633974483, which is the arctangent of 1 in radians."
"What does the CHR$ command do in C64 Basic?","The CHR$ command in C64 Basic is a string function that changes an ASCII value to a string. It takes one argument, which is the ASCII value you want to convert to a string. For example, if you want to convert the ASCII value 65 to a string, you would use the command CHR$ 65, which would return the string "A", which is the character corresponding to the ASCII value 65."
"What is the purpose of the CLOSE command in C64 Basic?","The CLOSE command in C64 Basic is an input/output statement that closes a channel to a device. It takes one argument, which is the channel number you want to close. For example, if you want to close channel 1, you would use the command CLOSE 1, which would close the channel to the device associated with channel 1."
"What is the function of the CLR command in C64 Basic?","The CLR command in C64 Basic is a statement that resets all variables. It does not take any arguments. When you use the CLR command, it resets all variables to their default values. This can be useful if you want to clear the values of all variables before starting a new program or section of code."
"What is the purpose of the CMD command in C64 Basic?","The CMD command in C64 Basic is an input/output statement that outputs data to an opened device or file that corresponds to a file number. It takes two arguments: the file number of the device or file you want to output to, and the data you want to output. For example, if you want to output the string "Hello" to file number 1, you would use the command CMD 1, "Hello". This would output the string "Hello" to the device or file associated with file number 1."