question,answer
"What command is used to open a channel for writing to a disk drive in C64 Basic?","To open a channel for writing to a disk drive in C64 Basic, the OPEN command is used. The syntax for this command is: OPEN (file#), (divlce#), (channel#). For example, to open channel 2 for writing to the disk drive, the command would be: OPEN 2,8,2. The number 8 is the device number for the disk drive, and the channel number can be any number from 2 to 14. Channels 0 to 1 are reserved for the operating system, and channel 15 is used for the command channel."
"What is the purpose of the PRINT# command in C64 Basic when used with the OPEN command?","The PRINT# command in C64 Basic is used to direct data to the disk drive when used with the OPEN command. For example, the command: PRINT#2,"N:NAME,ID" will direct the string "N:NAME,ID" to the disk drive on channel 2. This is useful for formatting a disk, as in the example provided in the text."
"What is the maximum number of characters that can be used for the name of a disk when formatting in C64 Basic?","When formatting a disk in C64 Basic, the name can be up to sixteen characters long."
"What is the purpose of the ID parameter in the OPEN command when formatting a disk in C64 Basic?","The ID parameter in the OPEN command when formatting a disk in C64 Basic is used to specify a two-character identifier for the disk. This can be any combination of numbers, letters, or both."
"What is the purpose of the CLQSE command in C64 Basic?","The CLQSE command in C64 Basic is used to close a file that was previously opened using the OPEN command. This is important to do after formatting a disk, to ensure that the file is properly closed."
"What is the difference between the standard format method and the faster format method for disks in C64 Basic?","The standard format method for disks in C64 Basic involves using the OPEN and PRINT# commands to format the disk, while the faster format method uses the OPEN command with the "S:" parameter. The faster format method is quicker, but it is important to note that it should only be used on disks that have already been formatted, as it will erase all data on the disk."
"What are the channel numbers that are reserved for the operating system in C64 Basic?","In C64 Basic, channels 0 to 1 are reserved for the operating system. These channels should not be used for data files, as they are used by the operating system for loading and saving."
"What is the purpose of the device number in the OPEN command in C64 Basic?","The device number in the OPEN command in C64 Basic specifies the device that the channel is connected to. For example, the number 8 is the device number for the disk drive. This is used to specify that the channel is connected to the disk drive, rather than another device such as a printer."
"What is the command channel in C64 Basic?","The command channel in C64 Basic is channel 15. This channel is used for sending commands to the operating system, rather than for data files. It is important to note that channels 0 to 1 are reserved for the operating system, and should not be used for data files."
"What is the maximum number of channels that can be used for data files in C64 Basic?","In C64 Basic, channels 2 to 14 are used for data to files. This means that there are a total of 13 channels that can be used for data files. Channels 0 to 1 are reserved for the operating system, and channel 15 is used for the command channel."