question,answer
"What safety precautions should be taken when installing, using, and servicing a monitor to avoid electrical shock or fire hazards?","1702 monitor SAFETY PRECAUTIONS

Electrical energy can perform many useful functions.  This unit has
been engineered and manufactured to assure your personal safety.  But
improper use can result in potential electrical shock or fire hazards.
In order not to defeat the safeguards incorporated in this monitor,
observe the following basic rules for its installation, use and
servicing.  And also follow all warnings and instructions marked on
your video monitor."