question,answer
"What is the purpose of the accumulator in a microprocessor?","The accumulator is the most important register in a microprocessor, serving as the universal working register for almost all operations. It is used for all arithmetic and logical operations, as well as almost all comparison instructions."
"Which register is used for the majority of arithmetic and logical operations in a microprocessor?","The accumulator is the register used for the majority of arithmetic and logical operations in a microprocessor. It is the most important register in the microprocessor and is used for almost all operations."
"Can you name a register that is used for comparison instructions in a microprocessor?","The accumulator is a register that is used for comparison instructions in a microprocessor. It is the most important register in the microprocessor and is used for almost all operations."
"What is the role of the accumulator in a microprocessor's arithmetic operations?","The accumulator plays a crucial role in a microprocessor's arithmetic operations, serving as the primary register for these operations. It is used for all arithmetic and logical operations in the microprocessor."
"Which register is used for logical operations in a microprocessor?","The accumulator is the register used for logical operations in a microprocessor. It is the most important register in the microprocessor and is used for almost all operations."
"What is the accumulator's role in a microprocessor's comparison instructions?","The accumulator plays a key role in a microprocessor's comparison instructions, serving as the primary register for these operations. Almost all comparison instructions in a microprocessor use the accumulator."
"Can you identify a register that is used for the majority of operations in a microprocessor?","The accumulator is a register that is used for the majority of operations in a microprocessor. It is the most important register in the microprocessor and is used for almost all operations."
"What is the accumulator's role in a microprocessor's operations?","The accumulator is the most important register in a microprocessor, serving as the universal working register for almost all operations. It is used for all arithmetic and logical operations, as well as almost all of the comparison instructions in the microprocessor."
"Which register is used for the majority of a microprocessor's instructions?","The accumulator is the register used for the majority of a microprocessor's instructions. It is the most important register in the microprocessor and is used for almost all operations."
"What is the accumulator's role in a microprocessor?","The accumulator is the most important register in a microprocessor, serving as the universal working register for almost all operations. It is used for all arithmetic and logical operations, as well as almost all of the comparison instructions in the microprocessor."