question,answer
"What is the Y-register in C64 assembly language?","The Y-register is an index register similar to the X-register in C64 assembly language. It serves purposes such as storing data and addressing memory locations. It can be used in arithmetic operations and can be manipulated using specific instructions."
"What are the functions of the Y-register in C64 assembly language?","The Y-register in C64 assembly language is used for storing data, addressing memory locations, and performing arithmetic operations. It can be manipulated using specific instructions and serves similar purposes as the X-register."
"What is the size of the program counter in C64 assembly language?","The program counter in C64 assembly language is a 16-bit register. It indicates the memory location from which the next instruction is to be executed."
"What is the role of the program counter in C64 assembly language?","The program counter in C64 assembly language is a register that is managed by the microprocessor. It indicates the memory location from which the next instruction is to be executed. Normally, you do not have direct control over the contents of this register."
"How is the program counter managed in C64 assembly language?","The program counter in C64 assembly language is managed by the microprocessor itself. It indicates the memory location from which the next instruction is to be executed. Normally, you do not have direct control over the contents of this register."
"What is the impact of the program counter on the execution of instructions in C64 assembly language?","The program counter in C64 assembly language indicates the memory location from which the next instruction is to be executed. It is managed by the microprocessor and normally, you do not have direct control over the contents of this register. This is important because it ensures the proper execution of instructions in the correct sequence."
"Can the Y-register be used for indirect addressing in C64 assembly language?","Yes, the Y-register can be used for indirect addressing in C64 assembly language. Indirect addressing is a method of addressing memory locations using a register as a pointer to the memory location."
"What is the difference between the Y-register and the program counter in C64 assembly language?","The Y-register in C64 assembly language is an index register used for storing data, addressing memory locations, and performing arithmetic operations. The program counter, on the other hand, is a 16-bit register that indicates the memory location from which the next instruction is to be executed. It is managed by the microprocessor and you do not have direct control over its contents."
"What is the size of the Y-register in C64 assembly language?","The Y-register in C64 assembly language is an index register, similar to the X-register, and its size is not specified in the given text. Both the X and Y-registers are 8-bit index registers in C64 assembly language."
"What is the impact of not having direct control over the program counter in C64 assembly language?","Not having direct control over the program counter in C64 assembly language means that the microprocessor manages the contents of this register. This ensures the proper execution of instructions in the correct sequence, as the program counter indicates the memory location from which the next instruction is to be executed."