question,answer
"What are the increment and decrement instructions in 6510 used for?","The increment and decrement instructions in 6510 are used for effective programming of loops and counters. They allow you to increment or decrement the contents of a register or memory location by one. These instructions correspond to the NEXT instruction in BASIC and can be used to simulate the STEP-1 instruction with the decrement commands."
"What are the equivalent BASIC instructions for the increment and decrement instructions in 6510?","The increment instructions in 6510 correspond to the NEXT instruction in BASIC, while the decrement commands can be used to simulate the STEP-1 instruction in BASIC."
"How do the increment and decrement instructions in 6510 affect the contents of a register or memory location?","The increment instructions in 6510 increase the contents of a register or memory location by one, while the decrement commands decrease the contents of a register or memory location by one."
"What is the purpose of the decrement commands in 6510?","The decrement commands in 6510 are used to simulate the STEP-1 instruction in BASIC. They can be used to decrement the contents of a register or memory location by one."
"How do the increment and decrement instructions in 6510 contribute to effective programming of loops and counters?","The increment and decrement instructions in 6510 are essential for effective programming of loops and counters. They allow you to increment or decrement the contents of a register or memory location by one, which is useful for keeping track of the number of iterations in a loop or the value of a counter."
"What is the difference between the increment and decrement instructions in 6510?","The increment instructions in 6510 increase the contents of a register or memory location by one, while the decrement commands decrease the contents of a register or memory location by one."
"Can the decrement commands in 6510 be used for purposes other than simulating the STEP-1 instruction in BASIC?","Yes, the decrement commands in 6510 can be used for any purpose that requires decrementing the contents of a register or memory location by one. Simulating the STEP-1 instruction in BASIC is just one example of how they can be used."
"Do the increment and decrement instructions in 6510 affect the condition of a conditional branching command?","No, the increment and decrement instructions in 6510 do not affect the condition of a conditional branching command. They are used to increment or decrement the contents of a register or memory location, not to affect the flow of control in a program."
"Are the increment and decrement instructions in 6510 used exclusively for loops and counters?","No, the increment and decrement instructions in 6510 are not used exclusively for loops and counters. They can be used for any purpose that requires incrementing or decrementing the contents of a register or memory location by one."
"What is the advantage of using the increment and decrement instructions in 6510 over other methods of incrementing or decrementing the contents of a register or memory location?","The increment and decrement instructions in 6510 are efficient and easy to use. They allow you to increment or decrement the contents of a register or memory location by one with a single instruction, which can make your code more concise and easier to read."