question,answer
"What is the purpose of the NOP instruction in C64 assembly language?","The NOP (No Operation) instruction in C64 assembly language is used to insert a null operation into a program, which does absolutely nothing. It is useful for removing operation codes from a program without shifting the rest of the commands. Additionally, it is used in delay loops, as it requires a certain amount of time to execute."
"How does the NOP instruction affect the execution of other commands in C64 assembly language?","The NOP instruction does not affect the execution of other commands in C64 assembly language. It is a null operation that is used to insert a delay or remove operation codes from a program without shifting the rest of the commands."
"What is an example of the use of the NOP instruction in C64 assembly language?","An example of the use of the NOP instruction in C64 assembly language is: LDA #$00 NOP STA $0400. In this example, the NOP instruction is used to insert a delay between the loading of the accumulator and the storage of the value in memory location $0400."
"What is the alternative name for the NOP instruction in C64 assembly language?","The alternative name for the NOP instruction in C64 assembly language is No Operation."
"What is the function of the NOP instruction in delay loops in C64 assembly language?","The NOP instruction is used in delay loops in C64 assembly language to introduce a delay. Since the NOP instruction requires a certain amount of time to execute, it can be used to introduce a delay in the execution of a program."
"What is the syntax of the NOP instruction in C64 assembly language?","The syntax of the NOP instruction in C64 assembly language is: NOP. It does not require any operands or arguments."
"What is the result of executing the NOP instruction in C64 assembly language?","The result of executing the NOP instruction in C64 assembly language is a null operation, which does not affect the state of the processor or memory."
"What is the difference between the NOP instruction and other instructions in C64 assembly language?","The difference between the NOP instruction and other instructions in C64 assembly language is that the NOP instruction does not perform any operation, while other instructions perform specific operations on data or memory."
"What is the use of the NOP instruction in program development in C64 assembly language?","The NOP instruction is used in program development in C64 assembly language to insert a delay or remove operation codes from a program without shifting the rest of the commands. It is also used in delay loops to introduce a delay in the execution of a program."
"What is the effect of the NOP instruction on the execution time of a program in C64 assembly language?","The NOP instruction increases the execution time of a program in C64 assembly language, as it requires a certain amount of time to execute. This can be useful in delay loops or when removing operation codes from a program without shifting the rest of the commands."