question,answer
"what is the binary representation of the first byte in the track cache buffer?","The first byte in the track cache buffer is represented as 01010101 in binary, where bit 7 is 0, bit 6 is 1, bit 5 is 0, bit 4 is 1, bit 3 is 0, bit 2 is 1, bit 1 is 0, and bit 0 is 1."
"what is the purpose of the F bit in the track cache buffer?","The F bit in the track cache buffer determines whether to write to the disk even if the data is not 'dirty', meaning it has not been modified. If F is 1, the write operation will occur regardless of the data's 'dirtiness'."
"what is the function of the S bit in the track cache buffer?","The S bit in the track cache buffer is used for side select, which determines which side of the disk to read from or write to."
"in which byte of the track cache buffer is the physical track number stored?","The physical track number is stored in byte 03 of the track cache buffer."
"what is the meaning of X in the track cache buffer?","X is a 'don't care' bit in the track cache buffer, meaning its value is not important or relevant for the operation being performed."
"how many bytes are in the track cache buffer?","The track cache buffer consists of at least 4 bytes, as shown in the table, with each byte representing different information about the disk."
"what is the significance of the bit pattern 00110000 in the track cache buffer?","The bit pattern 00110000 in the track cache buffer corresponds to the second byte, which has no specific meaning or function in this context."
"in which byte is the write operation controlled?","The write operation is controlled in byte 02 of the track cache buffer, where the F bit determines whether to write to the disk even if the data is not 'dirty'."
"what is the purpose of the track cache buffer?","The track cache buffer is a memory area that stores information about the disk, including the physical track number, side select, and write control, which is used by the disk controller to manage disk operations."
"how is the track cache buffer organized?","The track cache buffer is organized as a sequence of bytes, with each byte containing specific information about the disk, such as the physical track number, side select, and write control."