question,answer
"What is the purpose of the RESET_DV command in a C64 disk controller?","The RESET_DV command, represented by the opcode $82, is used to reset the disk controller and its associated variables, effectively reinitializing the controller and preparing it for new operations."
"What is the opcode for the RESET_DV command in a C64 disk controller?","The opcode for the RESET_DV command in a C64 disk controller is $82, which when executed, resets the disk controller and its associated variables."
"What happens when the RESET_DV command is executed in a C64 disk controller?","When the RESET_DV command is executed in a C64 disk controller, it resets the disk controller and its associated variables, which is essential for reinitializing the controller and preparing it for new operations."
"What is the significance of the RESET_DV command in a C64 disk controller?","The RESET_DV command is significant in a C64 disk controller as it allows for the reinitialization of the controller and its associated variables, which is crucial for maintaining data integrity and ensuring reliable disk operations."
"In what scenario would you use the RESET_DV command in a C64 disk controller?","You would use the RESET_DV command in a C64 disk controller when you need to reinitialize the controller and its associated variables, typically after a disk operation has failed or when the controller is in an unknown state."
"What is the relationship between the RESET_DV command and disk controller variables?","The RESET_DV command resets the disk controller and its associated variables, which means that all variables related to the disk controller are reinitialized to their default values."
"How does the RESET_DV command affect disk operations in a C64 disk controller?","The RESET_DV command affects disk operations in a C64 disk controller by reinitializing the controller and its associated variables, which ensures that subsequent disk operations are executed correctly and reliably."
"What is the role of the RESET_DV command in disk controller initialization?","The RESET_DV command plays a crucial role in disk controller initialization by reinitializing the controller and its associated variables, which is essential for preparing the controller for new disk operations."
"In what context is the RESET_DV command used in a C64 disk controller?","The RESET_DV command is used in a C64 disk controller in the context of disk operations, specifically when the controller needs to be reinitialized or reset to its default state."
"What is the benefit of using the RESET_DV command in a C64 disk controller?","The benefit of using the RESET_DV command in a C64 disk controller is that it ensures the controller and its associated variables are reinitialized, which helps to prevent data corruption and ensures reliable disk operations."