question,answer
"what is the purpose of the ERRLEDON_DV job command in a 1581 disk controller?","The ERRLEDON_DV job command is used to enable error LED blinking on a 1581 disk controller, which is a crucial feature for indicating errors or issues with the disk controller. This command is essential for troubleshooting and debugging purposes, allowing users to identify and diagnose problems with the disk controller more efficiently."
"what is the hex code for the ERRLEDON_DV job command?","The hex code for the ERRLEDON_DV job command is $98, which is a unique identifier for this specific command in the 1581 disk controller."
"what is the significance of error LED blinking in a 1581 disk controller?","Error LED blinking in a 1581 disk controller is a visual indicator of errors or issues with the disk controller, allowing users to quickly identify and respond to problems. This feature is critical for ensuring data integrity and preventing data loss due to disk controller malfunctions."
"how does the ERRLEDON_DV job command enhance troubleshooting capabilities?","The ERRLEDON_DV job command enhances troubleshooting capabilities by providing a visual cue for errors or issues with the disk controller, enabling users to quickly identify and diagnose problems. This facilitates faster troubleshooting and reduces downtime, ensuring that the disk controller is operational and data is accessible."
"what is the relationship between the ERRLEDON_DV job command and disk controller errors?","The ERRLEDON_DV job command is directly related to disk controller errors, as it enables error LED blinking to indicate the presence of errors or issues with the disk controller. This allows users to take corrective action to resolve the errors and prevent data loss or corruption."
"in what context is the ERRLEDON_DV job command typically used?","The ERRLEDON_DV job command is typically used in the context of troubleshooting and debugging disk controller issues, allowing users to quickly identify and diagnose problems with the disk controller."
"what is the benefit of using the ERRLEDON_DV job command in a 1581 disk controller?","The benefit of using the ERRLEDON_DV job command is that it provides a visual indicator of errors or issues with the disk controller, enabling users to quickly identify and respond to problems, thereby reducing downtime and ensuring data integrity."
"how does the ERRLEDON_DV job command impact disk controller performance?","The ERRLEDON_DV job command does not directly impact disk controller performance, but rather provides a diagnostic tool for identifying and resolving errors or issues that may be affecting performance. By enabling error LED blinking, users can quickly identify and address problems, ensuring optimal disk controller performance."
"what is the purpose of the $98 hex code in the ERRLEDON_DV job command?","The $98 hex code in the ERRLEDON_DV job command is a unique identifier that specifies the command to enable error LED blinking on a 1581 disk controller."
"in what type of system is the ERRLEDON_DV job command typically used?","The ERRLEDON_DV job command is typically used in systems that utilize a 1581 disk controller, such as Commodore 64 computers or other retrocomputing systems that rely on this type of disk controller."