question,answer
"What is the purpose of the TREAD_DV command in the 1581 disk controller job commands?","The TREAD_DV command is used to read a logical address without transferring the data to the job queue buffer, allowing for efficient data retrieval and processing."
"What is the significance of the $AA code in the 1581 disk controller job commands?","The $AA code is a crucial part of the TREAD_DV command, which enables the reading of logical addresses without transferring data to the job queue buffer, thereby optimizing system performance."
"How does the TREAD_DV command optimize system performance?","By not transferring data to the job queue buffer, the TREAD_DV command reduces memory usage and minimizes the risk of data corruption, resulting in improved system performance and reliability."
"What is the primary function of the job queue buffer in the 1581 disk controller?","The job queue buffer is a temporary storage area that holds data temporarily while it is being processed, allowing for efficient data transfer and processing, but the TREAD_DV command bypasses this buffer to improve performance."
"In what scenario would you use the TREAD_DV command instead of a regular read command?","When you need to read a logical address without occupying the job queue buffer, the TREAD_DV command is the preferred choice, ensuring that the buffer remains available for other tasks and reducing the risk of data congestion."
"What is the relationship between the TREAD_DV command and the job queue buffer?","The TREAD_DV command bypasses the job queue buffer, allowing for direct access to the logical address without occupying the buffer, whereas regular read commands rely on the buffer for data transfer."
"How does the TREAD_DV command differ from a regular read command?","Unlike regular read commands, the TREAD_DV command does not transfer data to the job queue buffer, providing a more efficient and optimized way of reading logical addresses."
"What are the implications of using the TREAD_DV command on system resources?","By not using the job queue buffer, the TREAD_DV command reduces memory usage and minimizes the risk of data corruption, resulting in more efficient use of system resources and improved overall performance."
"In what type of applications would the TREAD_DV command be particularly useful?","The TREAD_DV command is particularly useful in applications that require fast and efficient data retrieval, such as real-time systems, embedded systems, or applications with limited memory resources."
"What are the benefits of using the TREAD_DV command in terms of data integrity?","By bypassing the job queue buffer, the TREAD_DV command reduces the risk of data corruption and minimizes the risk of data loss, ensuring that data is retrieved accurately and efficiently."