question,answer
"what is the purpose of the DETWP_DV job command in a 1581 disk controller?","The DETWP_DV job command is used to check if the inserted disk is write protected. It returns a value of $00 if the disk is not write protected, and $08 if it is. This command is essential in determining the write protection status of a disk, allowing the controller to take appropriate actions accordingly."
"what value is returned by the DETWP_DV command if the disk is write protected?","The DETWP_DV command returns a value of $08 if the disk is write protected, indicating that the disk is protected from writing."
"what is the return value of the DETWP_DV command if the disk is not write protected?","The DETWP_DV command returns a value of $00 if the disk is not write protected, indicating that the disk is not protected from writing."
"in what scenario would the DETWP_DV command return a value of $08?","The DETWP_DV command would return a value of $08 if the inserted disk is write protected, meaning that the disk is protected from writing."
"what is the significance of the $B6 address in the context of the DETWP_DV command?","The $B6 address is the location where the DETWP_DV command is stored, and it is used to check if the inserted disk is write protected."
"can the DETWP_DV command be used to write to a write-protected disk?","No, the DETWP_DV command is used to check the write protection status of a disk, but it cannot be used to write to a write-protected disk. The command only returns a value indicating the write protection status, it does not allow writing to a protected disk."
"what is the purpose of the write protection check in the DETWP_DV command?","The write protection check in the DETWP_DV command is used to prevent accidental writing to a disk that is intended to be read-only, ensuring data integrity and preventing unintended changes to the disk's contents."
"in what type of device is the DETWP_DV command typically used?","The DETWP_DV command is typically used in a 1581 disk controller, which is a type of floppy disk controller used in Commodore computers."
"what is the benefit of using the DETWP_DV command in a disk controller?","The benefit of using the DETWP_DV command in a disk controller is that it allows the controller to determine the write protection status of a disk, enabling it to take appropriate actions to prevent accidental writing to a protected disk."
"can the DETWP_DV command be used to modify the write protection status of a disk?","No, the DETWP_DV command is a read-only command that only checks the write protection status of a disk, it cannot be used to modify the write protection status of a disk."