question,answer
"what is error code 22 in a 1581 disk controller?","Error code 22 in a 1581 disk controller is a READ ERROR, which occurs when the controller is requested to read or verify a data block that was not properly written, often in conjunction with BLOCK commands, and indicates an illegal track and/or sector request."
"What is the main reason for a READ ERROR in a 1581 disk controller?","The main reason for a READ ERROR in a 1581 disk controller is that the controller has been requested to read or verify a data block that was not properly written, resulting in an illegal track and/or sector request."
"What happens when a 1581 disk controller receives an illegal track and/or sector request?","When a 1581 disk controller receives an illegal track and/or sector request, it returns an error code 22, indicating a READ ERROR, because the data block was not properly written."
"What is the relationship between BLOCK commands and error code 22 in a 1581 disk controller?","There is a direct relationship between BLOCK commands and error code 22 in a 1581 disk controller, as error code 22 often occurs in conjunction with BLOCK commands, indicating an illegal track and/or sector request."
"What is the result of requesting a data block that was not properly written in a 1581 disk controller?","The result of requesting a data block that was not properly written in a 1581 disk controller is a READ ERROR, which is indicated by error code 22, and occurs when the controller is unable to read or verify the data block."
"How does a 1581 disk controller respond to an illegal track and/or sector request?","A 1581 disk controller responds to an illegal track and/or sector request by returning an error code 22, indicating a READ ERROR, because the data block was not properly written."
"What is the primary cause of a READ ERROR in a 1581 disk controller?","The primary cause of a READ ERROR in a 1581 disk controller is a data block that was not properly written, resulting in an illegal track and/or sector request."
"In what situation does a 1581 disk controller return an error code 22?","A 1581 disk controller returns an error code 22 when it is requested to read or verify a data block that was not properly written, resulting in an illegal track and/or sector request."
"What is the significance of error code 22 in a 1581 disk controller?","Error code 22 in a 1581 disk controller is significant because it indicates a READ ERROR, which occurs when the controller is unable to read or verify a data block that was not properly written, often due to an illegal track and/or sector request."
"What is the relationship between data block writing and error code 22 in a 1581 disk controller?","There is a direct relationship between data block writing and error code 22 in a 1581 disk controller, as error code 22 is returned when a data block was not properly written, resulting in a READ ERROR."