question,answer
"What is error code 25 in a 1581 disk controller command?","Error code 25 in a 1581 disk controller command indicates a WRITE ERROR, specifically a write-verify error, which occurs when the controller detects a mismatch between the data written to the diskette and the same data in disk memory, possibly indicating a faulty diskette, and suggesting the use of high-quality diskettes from reputable makers."
"What causes a write-verify error in a 1581 disk controller command?","A write-verify error in a 1581 disk controller command is caused by a mismatch between the data written to the diskette and the same data in disk memory, which can be indicative of a faulty diskette, and can be resolved by trying another diskette from a reputable maker."
"What is the possible reason for a WRITE ERROR in a 1581 disk controller command?","The possible reason for a WRITE ERROR in a 1581 disk controller command is a faulty diskette, which can be resolved by trying another high-quality diskette from a reputable maker."
"What should you do if you encounter a WRITE ERROR in a 1581 disk controller command?","If you encounter a WRITE ERROR in a 1581 disk controller command, you should try another diskette from a reputable maker, as the error may be indicative of a faulty diskette."
"What type of diskettes are recommended to avoid WRITE ERROR in a 1581 disk controller command?","High-quality diskettes from reputable makers are recommended to avoid WRITE ERROR in a 1581 disk controller command, as they are less likely to be faulty and cause write-verify errors."
"What is the relationship between a faulty diskette and a WRITE ERROR in a 1581 disk controller command?","A faulty diskette is a possible cause of a WRITE ERROR in a 1581 disk controller command, as it can lead to a mismatch between the data written to the diskette and the same data in disk memory, resulting in a write-verify error."
"What is the purpose of the write-verify process in a 1581 disk controller command?","The purpose of the write-verify process in a 1581 disk controller command is to ensure that the data written to the diskette matches the data in disk memory, and any mismatch will result in a WRITE ERROR."
"What happens when a 1581 disk controller detects a mismatch between the data written to the diskette and the same data in disk memory?","When a 1581 disk controller detects a mismatch between the data written to the diskette and the same data in disk memory, it returns a WRITE ERROR, indicating a write-verify error, which may be caused by a faulty diskette."
"What is the significance of using high-quality diskettes from reputable makers in a 1581 disk controller command?","Using high-quality diskettes from reputable makers in a 1581 disk controller command is significant because it reduces the likelihood of WRITE ERROR due to faulty diskettes, ensuring reliable data writing and verification."
"What is the consequence of a WRITE ERROR in a 1581 disk controller command?","The consequence of a WRITE ERROR in a 1581 disk controller command is that the data written to the diskette is unreliable, and the diskette may be faulty, requiring the use of another high-quality diskette from a reputable maker."