question,answer
"What is the error code 63 in a 1581 disk controller command?","Error code 63 in a 1581 disk controller command indicates that a file with the same name as the one being requested for a new file already exists on the diskette, and duplicate file names are not allowed, requiring the selection of another name."
"What happens when a file with the same name already exists on the diskette?","When a file with the same name already exists on the diskette, the 1581 disk controller returns an error code 63, indicating that duplicate file names are not allowed, and a new name must be selected."
"What is the reason for error code 63 in a 1581 disk controller command?","The reason for error code 63 in a 1581 disk controller command is that a file with the same name as the one being requested for a new file already exists on the diskette, and duplicate file names are not allowed."
"How do you resolve error code 63 in a 1581 disk controller command?","To resolve error code 63 in a 1581 disk controller command, you need to select another name for the new file, as duplicate file names are not allowed on the diskette."
"What is the significance of error code 63 in a 1581 disk controller command?","Error code 63 in a 1581 disk controller command is significant because it prevents duplicate file names on the diskette, ensuring that each file has a unique name, and avoiding potential file conflicts."
"What is the purpose of error code 63 in a 1581 disk controller command?","The purpose of error code 63 in a 1581 disk controller command is to prevent duplicate file names on the diskette, ensuring data integrity and organization."
"How does the 1581 disk controller handle duplicate file names?","The 1581 disk controller handles duplicate file names by returning an error code 63, indicating that a file with the same name already exists on the diskette, and requiring a new name to be selected."
"What is the consequence of not resolving error code 63 in a 1581 disk controller command?","If error code 63 in a 1581 disk controller command is not resolved, the file creation process will fail, and the file will not be created, as duplicate file names are not allowed on the diskette."
"What is the relationship between error code 63 and file names on a 1581 disk?","Error code 63 is directly related to file names on a 1581 disk, as it is triggered when a file with the same name already exists on the diskette, and duplicate file names are not allowed."
"Why does the 1581 disk controller return error code 63?","The 1581 disk controller returns error code 63 because it is designed to prevent duplicate file names on the diskette, ensuring that each file has a unique name, and avoiding potential file conflicts."