question,answer
"what does the error code 3 DOS MISMATCH indicate","The error code 3 DOS MISMATCH indicates that an attempt has been made to write to a diskette with an incompatible format, meaning the disk format is not compatible with the version of DOS being used."
"What is the significance of the message 'COPYRIGHT CBM DOS V10 1581'","The message 'COPYRIGHT CBM DOS V10 1581' indicates the version of DOS being used, which is version 10, specifically designed for the 1581 disk controller."
"What happens when the disk-error status is checked when the drive is first turned on","When the disk-error status is checked when the drive is first turned on, the message 'Controller commands error code 3: DOS MISMATCH' appears, which is not an error, but rather an easy way to see which version of DOS is in use."
"What is the purpose of the error code 3 DOS MISMATCH message","The purpose of the error code 3 DOS MISMATCH message is to inform the user that an attempt has been made to write to a diskette with an incompatible format, and to indicate which version of DOS is being used."
"Under what circumstances does the error code 3 DOS MISMATCH message appear","The error code 3 DOS MISMATCH message appears when an attempt is made to write to a diskette with an incompatible format, or when the disk-error status is checked when the drive is first turned on."
"What does the message 'Controller commands error code 3: DOS MISMATCH' indicate","The message 'Controller commands error code 3: DOS MISMATCH' indicates that an attempt has been made to write to a diskette with an incompatible format, or that the disk-error status is being checked when the drive is first turned on."
"What is the significance of the '1581' in the message 'COPYRIGHT CBM DOS V10 1581'","The '1581' in the message 'COPYRIGHT CBM DOS V10 1581' refers to the 1581 disk controller, which is the specific hardware component being used."
"What is the purpose of checking the disk-error status when the drive is first turned on","The purpose of checking the disk-error status when the drive is first turned on is to easily determine which version of DOS is being used, as indicated by the message 'Controller commands error code 3: DOS MISMATCH'."
"What is the relationship between the error code 3 DOS MISMATCH and the disk format","The error code 3 DOS MISMATCH is related to the disk format, as it indicates that an attempt has been made to write to a diskette with an incompatible format."
"What is the implication of the message 'COPYRIGHT CBM DOS V10 1581' on the disk format","The message 'COPYRIGHT CBM DOS V10 1581' implies that the disk format is compatible with the version of DOS being used, which is version 10, specifically designed for the 1581 disk controller."