question,answer
"what is error code 76 in a C64 floppy disk controller","Error code 76 in a C64 floppy disk controller indicates a CONTROLLER ERROR, meaning the floppy disk controller IC (WD177x) is not functioning properly, preventing the system from accessing the floppy disk."
"what is the WD177x IC responsible for in a C64 system","The WD177x IC is the floppy disk controller IC in a C64 system, responsible for managing the data transfer between the computer and the floppy disk drive, and is a critical component for reading and writing data to the floppy disk."
"what happens when the floppy disk controller IC (WD177x) is not functioning properly","When the floppy disk controller IC (WD177x) is not functioning properly, the system will return an error code 76, indicating a CONTROLLER ERROR, and the system will be unable to access the floppy disk, preventing the user from reading or writing data to the disk."
"what is the significance of the CONTROLLER ERROR code 76 in a C64 system","The CONTROLLER ERROR code 76 in a C64 system is a critical error that indicates a hardware failure of the floppy disk controller IC (WD177x), requiring immediate attention to resolve the issue and prevent data loss or corruption."
"what is the relationship between the WD177x IC and the floppy disk drive in a C64 system","The WD177x IC is directly connected to the floppy disk drive in a C64 system, and is responsible for controlling the flow of data between the computer and the floppy disk drive, making it a critical component for data storage and retrieval."
"what is the impact of a malfunctioning WD177x IC on a C64 system","A malfunctioning WD177x IC can cause a range of issues in a C64 system, including error codes, data loss, and corruption, and can even prevent the system from booting or accessing the floppy disk, making it essential to diagnose and repair or replace the faulty IC."
"how does the C64 system respond to a CONTROLLER ERROR code 76","The C64 system responds to a CONTROLLER ERROR code 76 by displaying an error message, indicating that the floppy disk controller IC (WD177x) is not functioning properly, and preventing the system from accessing the floppy disk until the issue is resolved."
"what is the role of the WD177x IC in the C64 floppy disk subsystem","The WD177x IC plays a central role in the C64 floppy disk subsystem, managing the data transfer between the computer and the floppy disk drive, and is responsible for controlling the motor, head movement, and data encoding and decoding."
"what are the consequences of ignoring a CONTROLLER ERROR code 76 in a C64 system","Ignoring a CONTROLLER ERROR code 76 in a C64 system can lead to further damage to the system, data loss, and corruption, and can even cause the system to become unstable or crash, making it essential to address the issue promptly."
"what is the relationship between the CONTROLLER ERROR code 76 and the floppy disk drive in a C64 system","The CONTROLLER ERROR code 76 is directly related to the floppy disk drive in a C64 system, indicating a problem with the floppy disk controller IC (WD177x) that prevents the system from accessing the floppy disk, and requires immediate attention to resolve the issue."