question,answer
"what is the purpose of the asterisk and question mark characters in pattern matching on the C64?","The asterisk (*) and question mark (?) characters are used in pattern matching to load a program from a partial name or to provide selective directories. The asterisk makes all characters in and beyond its position wild, while the question mark makes only its own position wild."
"how does the command LOAD\"A*\",8 work?","The command LOAD\"A*\",8 loads the first file on disk that begins with an A, regardless of what follows. This is because the asterisk (*) is a wild card that matches any characters after the A."
"what is the difference between the asterisk and question mark in pattern matching?","The asterisk (*) makes all characters in and beyond its position wild, while the question mark (?) makes only its own position wild."
"how does the command DLOAD\"SM?TH\" work?","The command DLOAD\"SM?TH\" loads the first file that starts with SM, ends with TH, and has one other character between. This is because the question mark (?) is a wild card that matches only one character."
"what is the purpose of the command DIRECTORY\"Q*\"?","The command DIRECTORY\"Q*\" loads a directory of files whose names begin with Q. This is because the asterisk (*) is a wild card that matches any characters after the Q."
"what is the special case of the command LOAD\"*\",8?","The special case of the command LOAD\"*\",8 is that it matches the last file used on the C64 and C128 in C64 mode."
"how does the command LOAD \"0:*\",8 work?","The command LOAD \"0:*\",8 loads the first file on the diskette on the C64 and C128 in C64 mode."
"what is the difference in behavior of the command DLOAD\"*\" between the C64 and C128 in C128 mode and the Plus/4?","On the C64 and C128 in C64 mode, the command DLOAD\"*\" does not work. However, on the Plus/4 and C128 in C128 mode, the command DLOAD\"*\" loads the first file on the diskette."
"can you use pattern matching to load a program from a partial name?","Yes, you can use pattern matching to load a program from a partial name by using the asterisk (*) and question mark (?) characters as wild cards."
"what is the advantage of using pattern matching in loading programs on the C64?","The advantage of using pattern matching in loading programs on the C64 is that it allows you to load a program from a partial name or to provide selective directories, making it easier to manage and load files."